{
  "$schema": "http://json-schema.org/draft-07/schema#",
  "title": "Store[]",
  "type": "array",
  "description": "Array of Store entities. One PR = one new item appended, or one file in the per-entity directory.",
  "items": {
    "title": "Store",
    "type": "object",
    "additionalProperties": false,
    "properties": {
      "createdAt": {
        "type": "string",
        "format": "date-time"
      },
      "createdBy": {
        "type": [
          "null",
          "string"
        ]
      },
      "updatedAt": {
        "type": [
          "null",
          "string"
        ],
        "format": "date-time"
      },
      "updatedBy": {
        "type": [
          "null",
          "string"
        ]
      },
      "id": {
        "type": "string"
      },
      "name": {
        "type": "string"
      },
      "description": {
        "type": [
          "null",
          "string"
        ]
      },
      "websiteUrl": {
        "type": "string"
      },
      "logoUrl": {
        "type": [
          "null",
          "string"
        ]
      },
      "isActive": {
        "type": "boolean"
      }
    }
  }
}