[
  {
    "id": "6659a1b2c3d4e5f6a7b8c901",
    "name": "Wolfhound Fightwear",
    "description": "Wolfhound Fightwear is an Irish martial arts brand that provides high-quality, affordable BJJ and MMA apparel. Their unique designs are inspired by Celtic mythology and the traditional Irish fighting spirit.",
    "websiteUrl": "https://www.wolfhoundfightwear.com/",
    "logoUrl": "/images/stores/6659a1b2c3d4e5f6a7b8c901/6659a1b2c3d4e5f6a7b8c901-lg.webp",
    "isActive": true,
    "createdAt": "2024-01-01T00:00:00Z",
    "createdBy": "seeder"
  }
]
