[
  {
    "id": "6659a1b2c3d4e5f6a7b8c901",
    "name": "Coffee and Kimuras",
    "description": "Homegrown Irish alternative brand that celebrates the martial arts lifestyle. They emphasize high-quality manufacturing combined with a clean, modern aesthetic.",
    "websiteUrl": "https://coffeekimuras.com/",
    "logoUrl": "",
    "isActive": true,
    "createdAt": "2024-01-01T00:00:00Z",
    "createdBy": "seeder"
  }
]
