[
  {
    "id": "6659a1b2c3d4e5f6a7b8c906",
    "name": "FightStore Dublin",
    "description": "",
    "websiteUrl": "https://www.fightstoredublin.ie/",
    "logoUrl": "/images/stores/6659a1b2c3d4e5f6a7b8c906/6659a1b2c3d4e5f6a7b8c906-lg.webp",
    "isActive": true,
    "createdAt": "2024-01-01T00:00:00Z",
    "createdBy": "seeder"
  }
]
