[
  {
    "id": "6659a1b2c3d4e5f6a7b8c904",
    "name": "Ground Game",
    "description": "",
    "websiteUrl": "https://groundgame.ie/",
    "logoUrl": "/images/stores/6659a1b2c3d4e5f6a7b8c904/6659a1b2c3d4e5f6a7b8c904-lg.webp",
    "isActive": true,
    "createdAt": "2024-01-01T00:00:00Z",
    "createdBy": "seeder"
  }
]
